{
  "schema_version": "2.0.0",
  "sidecar_type": "PROJECT_STATE",
  "markdown_source": "project-runtime/PROJECT_STATE.md",
  "state_revision": 1,
  "updated_at": "2026-01-01T00:00:00Z",
  "updated_by": "orchestrator",
  "content": {
    "project_name": "State Sidecar Fixture",
    "project_slug": "state-sidecar-fixture",
    "project_root": "/tmp/state-sidecar-fixture",
    "tz_path": "project-input/TZ.md",
    "active_doc_root": "project-docs",
    "package_version": "stage-2",
    "governance_ruleset_version": "stage-2",
    "runtime_schema_version": "2.0.0",
    "workspace_type": "test_fixture",
    "workspace_identity_ref": "project-runtime/WORKSPACE_IDENTITY.md",
    "repository_lock_ref": "project-runtime/REPOSITORY_LOCK.md",
    "project_root_expected": "/tmp/state-sidecar-fixture",
    "git_toplevel_actual": "/tmp/state-sidecar-fixture",
    "expected_remote": "git@example.invalid:fixture/state-sidecar.git",
    "actual_remote": "git@example.invalid:fixture/state-sidecar.git",
    "expected_git_remote": "git@example.invalid:fixture/state-sidecar.git",
    "actual_git_remote": "git@example.invalid:fixture/state-sidecar.git",
    "expected_branch": "fixture/main",
    "actual_branch": "fixture/main",
    "push_allowed": false,
    "identity_validation_status": "passed",
    "identity_validation_error": "NONE",
    "identity_validation_evidence": "fixture identity values match",
    "repository_lock_status": "accepted",
    "baseline_tracking_status": "passed",
    "project_input_tracking_policy": "owner-private/untracked",
    "checkpoint_eligibility": "not_applicable",
    "audit_status": "pending",
    "checkpoint_eligibility_status": "not_checked",
    "checkpoint_preflight_status": "not_run",
    "checkpoint_preflight_ref": "NONE",
    "checkpoint_receipt_ref": "NONE",
    "commit_status": "not_required",
    "last_commit_hash": "NONE",
    "last_commit_branch": "NONE",
    "push_status": "not_required",
    "last_push_remote": "NONE",
    "last_push_branch": "NONE",
    "last_push_target_status": "not_required",
    "project_checkpoint_status": "not_required",
    "checkpoint_blocked_by": [],
    "last_checkpoint_failure_reason": "NONE",
    "current_phase": "implementation",
    "project_status": "active",
    "action_semantic": "normal",
    "semantic_reason": "Fixture sidecar uses canonical Stage 2 values.",
    "active_branches": [
      {
        "branch_id": "BRANCH-main",
        "status": "active",
        "current_task": "TASK_FIXTURE_STATE_001",
        "current_agent_role": "developer",
        "dependencies": [],
        "blocked_by": ""
      }
    ],
    "completed_milestones": [],
    "active_risks": [],
    "active_blockers": [],
    "active_gaps": [],
    "last_accepted_result": "NONE"
  }
}
